{
  "$schema": "http://json-schema.org/draft-07/schema#",
  "type": "object",
  "required": ["director_id", "actor_id", "film_id", "year", "weight"],
  "properties": {
    "director_id": { "type": "string" },
    "actor_id": { "type": "string" },
    "film_id": { "type": "string" },
    "year": { "type": "integer" },
    "weight": { "type": "number" }
  }
}
