[
  { "director_id": "Q12345", "actor_id": "Q200", "film_id": "Q9981", "year": 2022, "weight": 0.9 },
  { "director_id": "Q12345", "actor_id": "Q201", "film_id": "Q9981", "year": 2022, "weight": 0.7 },
  { "director_id": "Q67890", "actor_id": "Q204", "film_id": "Q9983", "year": 2021, "weight": 0.8 }
]
